Name,Effect,Map
Crab Pincer,gain rage x1 at start of battle.,piratesbay
Pirate Bandana,+1 to all rage gained.,piratesbay
Horn,rage damage bonus for you is now 50% instead of 25%.,piratesbay
Pirate Flag,+10% rage attack damage bonus per level of rage. ,skullsisland
Great Fang ,"whenever an enemy gains rage, gain 1 rage. ",lostislands
Ox Horn,"if you are not attacked on the enemy's turn, gain 1 rage at the start of your next turn.",northernlands
Rage Scroll,gain rage x3 at start of battle.,heroes
